{
  "schema": "iicp.pre1-feature-baseline.v1",
  "updated_at": "2026-08-26",
  "status": "SPECIFICATION_RECONCILIATION",
  "non_authorizing": true,
  "stable_designation_authorized": false,
  "scope": "client-directory-management",
  "scope_rule": "A coordinated stable designation may cover only REQUIRED_STABLE and COMPATIBILITY_ANCHOR capabilities. Optional, experimental, research and unsupported surfaces remain outside that claim unless a later reviewed baseline adds them and their full evidence passes.",
  "classification_semantics": {
    "REQUIRED_STABLE": "Required in every applicable declared support cell before coordinated promotion.",
    "COMPATIBILITY_ANCHOR": "Existing behavior required to preserve compatibility while its replacement or retirement remains separately gated.",
    "OPTIONAL_STABLE": "A supported additive surface that does not block the coordinated baseline when absent from a component.",
    "EXPERIMENTAL": "Implemented or useful, but excluded from the coordinated stable claim.",
    "RESEARCH": "A question or candidate mechanism, not a release commitment.",
    "UNSUPPORTED": "Explicitly outside the declared baseline. It must not be inferred from adjacent support."
  },
  "compatibility_rules": {
    "unknown_required_data": "fail_closed",
    "unknown_optional_data": "ignore_or_negotiate_as_declared",
    "directory_authority": "php_genesis_preserved",
    "rust_directory_role": "non_serving_candidate_until_separate_cutover",
    "management_authority": "domain_local_controller_only",
    "task_payload_path": "direct_client_to_provider",
    "wire_change_rule": "Update the specification, fixtures and compatibility environment before candidate evidence is accepted."
  },
  "component_reviews": [
    {
      "component": "client-python",
      "repository": "RobLe3/iicp-client-python",
      "issue": 119,
      "status": "OPEN"
    },
    {
      "component": "client-typescript",
      "repository": "RobLe3/iicp-client-typescript",
      "issue": 104,
      "status": "OPEN"
    },
    {
      "component": "client-rust",
      "repository": "RobLe3/iicp-client-rust",
      "issue": 150,
      "status": "OPEN"
    },
    {
      "component": "directory-php",
      "repository": "RobLe3/iicp-directory-php",
      "issue": 140,
      "status": "OPEN"
    },
    {
      "component": "directory-rust",
      "repository": "RobLe3/iicp-directory-rust",
      "issue": 102,
      "status": "OPEN"
    },
    {
      "component": "management",
      "repository": "RobLe3/iicp-management",
      "issue": 143,
      "status": "OPEN"
    }
  ],
  "capabilities": [
    {
      "id": "intent-task-envelope",
      "title": "Intent identifiers and direct task envelopes",
      "classification": "REQUIRED_STABLE",
      "authority_refs": [
        "spec/v1.9/iicp-core.md",
        "spec/v1.9/iicp-semantics.md",
        "registry/fixtures/intent-payloads-v1.json"
      ],
      "fixture_refs": [
        "registry/fixtures/intent-payloads-v1.json"
      ],
      "implementations": [
        "RobLe3/iicp-client-python",
        "RobLe3/iicp-client-typescript",
        "RobLe3/iicp-client-rust"
      ],
      "boundary": "Directories return routing information and never receive task payloads.",
      "contradiction_status": "CLEAR"
    },
    {
      "id": "directory-registration-heartbeat-discovery",
      "title": "Registration, heartbeat and discovery",
      "classification": "REQUIRED_STABLE",
      "authority_refs": [
        "spec/v1.9/iicp-dir.md"
      ],
      "fixture_refs": [
        "conformance-runner/src/iicp_conformance/fixtures/directory-public-v1.json",
        "conformance-runner/src/iicp_conformance/fixtures/directory-dispatch-v1.json"
      ],
      "implementations": [
        "RobLe3/iicp-directory-php",
        "RobLe3/iicp-directory-rust",
        "RobLe3/iicp-client-python",
        "RobLe3/iicp-client-typescript",
        "RobLe3/iicp-client-rust"
      ],
      "boundary": "PHP and Rust are tested in isolated authority lanes.",
      "contradiction_status": "CLEAR"
    },
    {
      "id": "public-route-free-discovery",
      "title": "Route-free public directory projection",
      "classification": "REQUIRED_STABLE",
      "authority_refs": [
        "spec/v1.9/iicp-dir.md"
      ],
      "fixture_refs": [
        "conformance-runner/src/iicp_conformance/fixtures/directory-public-v1.json"
      ],
      "implementations": [
        "RobLe3/iicp-directory-php",
        "RobLe3/iicp-directory-rust"
      ],
      "boundary": "Public presentation and observation do not disclose provider routes.",
      "contradiction_status": "CLEAR"
    },
    {
      "id": "ticketed-dispatch",
      "title": "Endpoint-safe ticketed dispatch",
      "classification": "REQUIRED_STABLE",
      "authority_refs": [
        "spec/v1.9/iicp-dir.md",
        "research/pre-normative-profiles/fixtures/dispatch-route-ticket-v1.json"
      ],
      "fixture_refs": [
        "conformance-runner/src/iicp_conformance/fixtures/dispatch-route-ticket-v1.json",
        "conformance-runner/src/iicp_conformance/fixtures/dispatch-ticket-trust-v2.json",
        "conformance-runner/src/iicp_conformance/fixtures/dispatch-ticket-trust-v2-crypto.json"
      ],
      "implementations": [
        "RobLe3/iicp-directory-php",
        "RobLe3/iicp-directory-rust",
        "RobLe3/iicp-client-python",
        "RobLe3/iicp-client-typescript",
        "RobLe3/iicp-client-rust"
      ],
      "boundary": "Ticket support is required; changing the default view or retiring legacy dispatch remains a separate adoption decision.",
      "contradiction_status": "CLEAR_WITH_EXPLICIT_BOUNDARY"
    },
    {
      "id": "legacy-dispatch-compatibility",
      "title": "Legacy route-bearing dispatch projection",
      "classification": "COMPATIBILITY_ANCHOR",
      "authority_refs": [
        "spec/v1.9/iicp-dir.md"
      ],
      "fixture_refs": [
        "conformance-runner/src/iicp_conformance/fixtures/directory-dispatch-v1.json"
      ],
      "implementations": [
        "RobLe3/iicp-directory-php",
        "RobLe3/iicp-directory-rust"
      ],
      "boundary": "Compatibility support is not endorsement as the future default and cannot be retired without external-client and rollback evidence.",
      "contradiction_status": "CLEAR_WITH_EXPLICIT_BOUNDARY"
    },
    {
      "id": "effective-capability-eligibility",
      "title": "Effective capability and eligibility before ranking",
      "classification": "REQUIRED_STABLE",
      "authority_refs": [
        "spec/v1.9/node-capability-format.md",
        "research/pre-normative-profiles/fixtures/effective-capability-v1.json"
      ],
      "fixture_refs": [
        "research/pre-normative-profiles/fixtures/effective-capability-v1.json",
        "research/pre-normative-profiles/fixtures/selection-v1.json"
      ],
      "implementations": [
        "RobLe3/iicp-directory-php",
        "RobLe3/iicp-directory-rust",
        "RobLe3/iicp-client-python",
        "RobLe3/iicp-client-typescript",
        "RobLe3/iicp-client-rust"
      ],
      "boundary": "Mandatory eligibility is evaluated before preference or ranking.",
      "contradiction_status": "CLEAR"
    },
    {
      "id": "identity-token-lifecycle",
      "title": "Node identity, ownership and token lifecycle",
      "classification": "REQUIRED_STABLE",
      "authority_refs": [
        "spec/v1.9/iicp-identity-slot.md",
        "research/pre-normative-profiles/fixtures/e050-client-credential-lifecycle-v1.json"
      ],
      "fixture_refs": [
        "research/pre-normative-profiles/fixtures/e050-client-credential-lifecycle-v1.json",
        "research/pre-normative-profiles/fixtures/e050-strict-v0.json"
      ],
      "implementations": [
        "RobLe3/iicp-directory-php",
        "RobLe3/iicp-directory-rust",
        "RobLe3/iicp-client-python",
        "RobLe3/iicp-client-typescript",
        "RobLe3/iicp-client-rust"
      ],
      "boundary": "Credential continuity is required; enabling strict E050 in production remains a separately reviewed migration.",
      "contradiction_status": "CLEAR_WITH_EXPLICIT_BOUNDARY"
    },
    {
      "id": "service-lifecycle",
      "title": "Task lifecycle, cancellation, retry and idempotency",
      "classification": "REQUIRED_STABLE",
      "authority_refs": [
        "spec/v1.9/iicp-service-lifecycle-profile.md"
      ],
      "fixture_refs": [
        "conformance-runner/src/iicp_conformance/fixtures/directory-lifecycle-v1.json",
        "research/pre-normative-profiles/fixtures/service-lifecycle-v1.json"
      ],
      "implementations": [
        "RobLe3/iicp-client-python",
        "RobLe3/iicp-client-typescript",
        "RobLe3/iicp-client-rust",
        "RobLe3/iicp-directory-php",
        "RobLe3/iicp-directory-rust"
      ],
      "boundary": "Task state, execution attempts and transport connections remain distinct.",
      "contradiction_status": "CLEAR"
    },
    {
      "id": "restricted-trust-domain",
      "title": "Restricted trust-domain operation",
      "classification": "REQUIRED_STABLE",
      "authority_refs": [
        "research/pre-normative-profiles/fixtures/restricted-trust-domain-v0.json",
        "research/pre-normative-profiles/fixtures/restricted-trust-domain-directory-decision-v0.json"
      ],
      "fixture_refs": [
        "research/pre-normative-profiles/fixtures/restricted-trust-domain-membership-v0.json",
        "research/pre-normative-profiles/fixtures/restricted-trust-domain-bootstrap-v0.json"
      ],
      "implementations": [
        "RobLe3/iicp-client-python",
        "RobLe3/iicp-client-typescript",
        "RobLe3/iicp-client-rust",
        "RobLe3/iicp-directory-php",
        "RobLe3/iicp-directory-rust"
      ],
      "boundary": "This is a project-owned, pre-normative profile and does not imply standards ratification or cross-domain federation.",
      "contradiction_status": "CLEAR_WITH_EXPLICIT_BOUNDARY"
    },
    {